{
    "schemaVersion":  1,
    "taskId":  "double-entry-ledger",
    "agent":  "codex",
    "branch":  "codex/double-entry-ledger-mvp",
    "status":  "released",
    "acquiredAt":  "2026-06-24T12:57:08.1125363+00:00",
    "expiresAt":  "2026-06-24T17:07:35.8828445+00:00",
    "updatedAt":  "2026-06-24T17:07:35.8828445+00:00"
}
